{
  "schema_version": 1,
  "diagram_type": "sequence",
  "meta": { "title": "Request sequence", "output": "minimal.sequence.html", "input_contract": "phoenix-v1", "quality_profile": "showcase", "locale": "en" },
  "participants": [
    { "id": "client", "type": "frontend", "label": "Client" },
    { "id": "service", "type": "backend", "label": "Service" }
  ],
  "messages": [
    { "id": "request", "from": "client", "to": "service", "y": 180, "label": "Request" },
    { "id": "result", "from": "service", "to": "client", "y": 236, "label": "Result", "variant": "return" }
  ]
}
